{
  "company": "Rockwell Automation",
  "industry": "industrial automation",
  "size_estimate": "large, tens of thousands of employees globally",
  "business_model": "Sells industrial automation and information hardware, software, and services to manufacturers — revenue comes from equipment sales, software licensing, and long-term service contracts.",
  "recent_signals": [
    "Public commentary on expanding software and AI-enabled offerings within its industrial automation portfolio"
  ],
  "likely_priorities": [
    "growing recurring software/services revenue alongside hardware",
    "helping manufacturing customers modernize plant-level data and automation"
  ],
  "possible_pain_points": [
    "customers may have fragmented plant-level data that makes enterprise-wide AI adoption difficult",
    "integrating newer software offerings with a large existing installed hardware base"
  ],
  "evidence": [
    "general industry knowledge of Rockwell Automation's core business (industrial automation hardware/software) as of the model's training — not verified against a live, dated source"
  ],
  "confidence": 0.35
}
